ID,Quote,Author,Tags,Tags Count,Timestamp
1058,"“It is not a lack of love, but a lack of friendship that makes unhappy marriages.”",Friedrich Nietzsche,"friendship, lack-of-friendship, lack-of-love, love, marriage, unhappy-marriage",6,2025-11-08T20:14:38.700456
1059,"“I love you without knowing how, or when, or from where. I love you simply, without problems or pride: I love you in this way because I do not know any other way of loving but this, in which there is no I or you, so intimate that your hand upon my chest is my hand, so intimate that when I fall asleep your eyes close.”",Pablo Neruda,"love, poetry",2,2025-11-08T20:14:38.700550
1060,"“If you can make a woman laugh, you can make her do anything.”",Marilyn Monroe,"girls, love",2,2025-11-08T20:14:38.700644
1061,“The real lover is the man who can thrill you by kissing your forehead or smiling into your eyes or just staring into space.”,Marilyn Monroe,love,1,2025-11-08T20:14:38.700730
1062,"“Love does not begin and end the way we seem to think it does. Love is a battle, love is a war; love is a growing up.”",James Baldwin,love,1,2025-11-08T20:14:38.700817
1063,"“There is nothing I would not do for those who are really my friends. I have no notion of loving people by halves, it is not my nature.”",Jane Austen,"friendship, love",2,2025-11-08T20:14:38.700909
1064,"“To love at all is to be vulnerable. Love anything and your heart will be wrung and possibly broken. If you want to make sure of keeping it intact you must give it to no one, not even an animal. Wrap it carefully round with hobbies and little luxuries; avoid all entanglements. Lock it up safe in the casket or coffin of your selfishness. But in that casket, safe, dark, motionless, airless, it will change. It will not be broken; it will become unbreakable, impenetrable, irredeemable. To love is to be vulnerable.”",C.S. Lewis,love,1,2025-11-08T20:14:39.882576
1065,“If I had a flower for every time I thought of you...I could walk through my garden forever.”,Alfred Tennyson,"friendship, love",2,2025-11-08T20:14:39.882738
1066,"“A lady's imagination is very rapid; it jumps from admiration to love, from love to matrimony in a moment.”",Jane Austen,"humor, love, romantic, women",4,2025-11-08T20:14:39.882882
1067,“To die will be an awfully big adventure.”,J.M. Barrie,"adventure, love",2,2025-11-08T20:14:39.883011
1068,“There are only two ways to live your life. One is as though nothing is a miracle. The other is as though everything is a miracle.”,Albert Einstein,"inspirational, life, live, miracle, miracles",5,2025-11-08T20:14:42.425990
1069,“It is better to be hated for what you are than to be loved for what you are not.”,André Gide,"life, love",2,2025-11-08T20:14:42.426115
1070,"“I may not have gone where I intended to go, but I think I have ended up where I needed to be.”",Douglas Adams,"life, navigation",2,2025-11-08T20:14:42.426328
1071,"“Good friends, good books, and a sleepy conscience: this is the ideal life.”",Mark Twain,"books, contentment, friends, friendship, life",5,2025-11-08T20:14:42.426445
1072,“Life is what happens to us while we are making other plans.”,Allen Saunders,"fate, life, misattributed-john-lennon, planning, plans",5,2025-11-08T20:14:42.426587
1073,"“Today you are You, that is truer than true. There is no one alive who is Youer than You.”",Dr. Seuss,"comedy, life, yourself",3,2025-11-08T20:14:42.426695
1074,"“Life is like riding a bicycle. To keep your balance, you must keep moving.”",Albert Einstein,"life, simile",2,2025-11-08T20:14:42.426794
1075,“Life isn't about finding yourself. Life is about creating yourself.”,George Bernard Shaw,"inspirational, life, yourself",3,2025-11-08T20:14:42.426900
1076,“Finish each day and be done with it. You have done what you could. Some blunders and absurdities no doubt crept in; forget them as soon as you can. Tomorrow is a new day. You shall begin it serenely and with too high a spirit to be encumbered with your old nonsense.”,Ralph Waldo Emerson,"life, regrets",2,2025-11-08T20:14:42.427003
1077,“The fear of death follows from the fear of life. A man who lives fully is prepared to die at any time.”,Mark Twain,"death, life",2,2025-11-08T20:14:43.607153
1078,"“I'm the one that's got to die when it's time for me to die, so let me live my life the way I want to.”",Jimi Hendrix,"death, life",2,2025-11-08T20:14:43.607268
1079,“But better to get hurt by the truth than comforted with a lie.”,Khaled Hosseini,life,1,2025-11-08T20:14:43.607357
1080,"“The person, be it gentleman or lady, who has not pleasure in a good novel, must be intolerably stupid.”",Jane Austen,"aliteracy, books, classic, humor",4,2025-11-08T20:14:45.928525
1081,"“A day without sunshine is like, you know, night.”",Steve Martin,"humor, obvious, simile",3,2025-11-08T20:14:45.928677
1082,“Anyone who thinks sitting in church can make you a Christian must also think that sitting in a garage can make you a car.”,Garrison Keillor,"humor, religion",2,2025-11-08T20:14:45.928796
1083,“Beauty is in the eye of the beholder and it may be necessary from time to time to give a stupid or misinformed beholder a black eye.”,Jim Henson,humor,1,2025-11-08T20:14:45.928910
1084,“All you need is love. But a little chocolate now and then doesn't hurt.”,Charles M. Schulz,"chocolate, food, humor",3,2025-11-08T20:14:45.929043
1085,"“Remember, we're madly in love, so it's all right to kiss me anytime you feel like it.”",Suzanne Collins,humor,1,2025-11-08T20:14:45.929154
1086,“Some people never go crazy. What truly horrible lives they must lead.”,Charles Bukowski,humor,1,2025-11-08T20:14:45.929262
1087,"“The trouble with having an open mind, of course, is that people will insist on coming along and trying to put things in it.”",Terry Pratchett,"humor, open-mind, thinking",3,2025-11-08T20:14:45.929385
1088,"“Think left and think right and think low and think high. Oh, the thinks you can think up if only you try!”",Dr. Seuss,"humor, philosophy",2,2025-11-08T20:14:45.929503
1089,“The reason I talk to myself is because I’m the only one whose answers I accept.”,George Carlin,"humor, insanity, lies, lying, self-indulgence, truth",6,2025-11-08T20:14:45.929647
1090,“I am free of all prejudice. I hate everyone equally. ”,W.C. Fields,"humor, sinister",2,2025-11-08T20:14:47.107225
1091,"“A lady's imagination is very rapid; it jumps from admiration to love, from love to matrimony in a moment.”",Jane Austen,"humor, love, romantic, women",4,2025-11-08T20:14:47.107471
1092,"“The person, be it gentleman or lady, who has not pleasure in a good novel, must be intolerably stupid.”",Jane Austen,"aliteracy, books, classic, humor",4,2025-11-08T20:14:49.434840
1093,"“Good friends, good books, and a sleepy conscience: this is the ideal life.”",Mark Twain,"books, contentment, friends, friendship, life",5,2025-11-08T20:14:49.434975
1094,“I have always imagined that Paradise will be a kind of library.”,Jorge Luis Borges,"books, library",2,2025-11-08T20:14:49.435067
1095,“You can never get a cup of tea large enough or a book long enough to suit me.”,C.S. Lewis,"books, inspirational, reading, tea",4,2025-11-08T20:14:49.435170
1096,"“If you only read the books that everyone else is reading, you can only think what everyone else is thinking.”",Haruki Murakami,"books, thought",2,2025-11-08T20:14:49.435263
1097,“There is no friend as loyal as a book.”,Ernest Hemingway,"books, friends, novelist-quotes",3,2025-11-08T20:14:49.435360
1098,"“What really knocks me out is a book that, when you're all done reading it, you wish the author that wrote it was a terrific friend of yours and you could call him up on the phone whenever you felt like it. That doesn't happen much, though.”",J.D. Salinger,"authors, books, literature, reading, writing",5,2025-11-08T20:14:49.435467
1099,“′Classic′ - a book which people praise and don't read.”,Mark Twain,"books, classic, reading",3,2025-11-08T20:14:49.435567
1100,"“I declare after all there is no enjoyment like reading! How much sooner one tires of any thing than of a book! -- When I have a house of my own, I shall be miserable if I have not an excellent library.”",Jane Austen,"books, library, reading",3,2025-11-08T20:14:49.435676
1101,"“You have to write the book that wants to be written. And if the book will be too difficult for grown-ups, then you write it for children.”",Madeleine L'Engle,"books, children, difficult, grown-ups, write, writers, writing",7,2025-11-08T20:14:49.435795
1102,"“... a mind needs books as a sword needs a whetstone, if it is to keep its edge.”",George R.R. Martin,"books, mind",2,2025-11-08T20:14:50.667319
1103,"“The more that you read, the more things you will know. The more that you learn, the more places you'll go.”",Dr. Seuss,"learning, reading, seuss",3,2025-11-08T20:14:52.990752
1104,“We read to know we're not alone.”,William Nicholson,"misattributed-to-c-s-lewis, reading",2,2025-11-08T20:14:52.990873
1105,"“A reader lives a thousand lives before he dies, said Jojen. The man who never reads lives only one.”",George R.R. Martin,"read, readers, reading, reading-books",4,2025-11-08T20:14:52.990974
1106,“You can never get a cup of tea large enough or a book long enough to suit me.”,C.S. Lewis,"books, inspirational, reading, tea",4,2025-11-08T20:14:52.991075
1107,"“What really knocks me out is a book that, when you're all done reading it, you wish the author that wrote it was a terrific friend of yours and you could call him up on the phone whenever you felt like it. That doesn't happen much, though.”",J.D. Salinger,"authors, books, literature, reading, writing",5,2025-11-08T20:14:52.991184
1108,“′Classic′ - a book which people praise and don't read.”,Mark Twain,"books, classic, reading",3,2025-11-08T20:14:52.991286
1109,"“I declare after all there is no enjoyment like reading! How much sooner one tires of any thing than of a book! -- When I have a house of my own, I shall be miserable if I have not an excellent library.”",Jane Austen,"books, library, reading",3,2025-11-08T20:14:52.991383
1110,"“It is not a lack of love, but a lack of friendship that makes unhappy marriages.”",Friedrich Nietzsche,"friendship, lack-of-friendship, lack-of-love, love, marriage, unhappy-marriage",6,2025-11-08T20:14:55.321478
1111,"“Good friends, good books, and a sleepy conscience: this is the ideal life.”",Mark Twain,"books, contentment, friends, friendship, life",5,2025-11-08T20:14:55.321710
1112,"“The truth is, everyone is going to hurt you. You just got to find the ones worth suffering for.”",Bob Marley,friendship,1,2025-11-08T20:14:55.321808
1113,"“There is nothing I would not do for those who are really my friends. I have no notion of loving people by halves, it is not my nature.”",Jane Austen,"friendship, love",2,2025-11-08T20:14:55.321899
1114,“If I had a flower for every time I thought of you...I could walk through my garden forever.”,Alfred Tennyson,"friendship, love",2,2025-11-08T20:14:55.321991
1115,“The world as we have created it is a process of our thinking. It cannot be changed without changing our thinking.”,Albert Einstein,"change, deep-thoughts, thinking, world",4,2025-11-08T20:14:21.266785
1116,"“It is our choices, Harry, that show what we truly are, far more than our abilities.”",J.K. Rowling,"abilities, choices",2,2025-11-08T20:14:21.267252
1117,“There are only two ways to live your life. One is as though nothing is a miracle. The other is as though everything is a miracle.”,Albert Einstein,"inspirational, life, live, miracle, miracles",5,2025-11-08T20:14:21.267387
1118,"“The person, be it gentleman or lady, who has not pleasure in a good novel, must be intolerably stupid.”",Jane Austen,"aliteracy, books, classic, humor",4,2025-11-08T20:14:21.267499
1119,"“Imperfection is beauty, madness is genius and it's better to be absolutely ridiculous than absolutely boring.”",Marilyn Monroe,"be-yourself, inspirational",2,2025-11-08T20:14:21.267600
1120,“Try not to become a man of success. Rather become a man of value.”,Albert Einstein,"adulthood, success, value",3,2025-11-08T20:14:21.267703
1121,“It is better to be hated for what you are than to be loved for what you are not.”,André Gide,"life, love",2,2025-11-08T20:14:21.267800
1122,"“I have not failed. I've just found 10,000 ways that won't work.”",Thomas A. Edison,"edison, failure, inspirational, paraphrased",4,2025-11-08T20:14:21.267909
1123,“A woman is like a tea bag; you never know how strong it is until it's in hot water.”,Eleanor Roosevelt,misattributed-eleanor-roosevelt,1,2025-11-08T20:14:21.267999
1124,"“A day without sunshine is like, you know, night.”",Steve Martin,"humor, obvious, simile",3,2025-11-08T20:14:21.268099
1125,"“It takes a great deal of bravery to stand up to our enemies, but just as much to stand up to our friends.”",J.K. Rowling,"courage, friends",2,2025-11-08T20:14:22.598644
1126,"“If you can't explain it to a six year old, you don't understand it yourself.”",Albert Einstein,"simplicity, understand",2,2025-11-08T20:14:22.598763
1127,"“You may not be her first, her last, or her only. She loved before she may love again. But if she loves you now, what else matters? She's not perfect—you aren't either, and the two of you may never be perfect together but if she can make you laugh, cause you to think twice, and admit to being human and making mistakes, hold onto her and give her the most you can. She may not be thinking about you every second of the day, but she will give you a part of her that she knows you can break—her heart. So don't hurt her, don't change her, don't analyze and don't expect more than she can give. Smile when she makes you happy, let her know when she makes you mad, and miss her when she's not there.”",Bob Marley,love,1,2025-11-08T20:14:22.598860
1128,"“I like nonsense, it wakes up the brain cells. Fantasy is a necessary ingredient in living.”",Dr. Seuss,fantasy,1,2025-11-08T20:14:22.599100
1129,"“I may not have gone where I intended to go, but I think I have ended up where I needed to be.”",Douglas Adams,"life, navigation",2,2025-11-08T20:14:22.599199
1130,"“The opposite of love is not hate, it's indifference. The opposite of art is not ugliness, it's indifference. The opposite of faith is not heresy, it's indifference. And the opposite of life is not death, it's indifference.”",Elie Wiesel,"activism, apathy, hate, indifference, inspirational, love, opposite, philosophy",8,2025-11-08T20:14:22.599324
1131,"“It is not a lack of love, but a lack of friendship that makes unhappy marriages.”",Friedrich Nietzsche,"friendship, lack-of-friendship, lack-of-love, love, marriage, unhappy-marriage",6,2025-11-08T20:14:22.599438
1132,"“Good friends, good books, and a sleepy conscience: this is the ideal life.”",Mark Twain,"books, contentment, friends, friendship, life",5,2025-11-08T20:14:22.599545
1133,“Life is what happens to us while we are making other plans.”,Allen Saunders,"fate, life, misattributed-john-lennon, planning, plans",5,2025-11-08T20:14:22.599650
1134,"“I love you without knowing how, or when, or from where. I love you simply, without problems or pride: I love you in this way because I do not know any other way of loving but this, in which there is no I or you, so intimate that your hand upon my chest is my hand, so intimate that when I fall asleep your eyes close.”",Pablo Neruda,"love, poetry",2,2025-11-08T20:14:23.790618
1135,“For every minute you are angry you lose sixty seconds of happiness.”,Ralph Waldo Emerson,happiness,1,2025-11-08T20:14:23.790736
1136,"“If you judge people, you have no time to love them.”",Mother Teresa,attributed-no-source,1,2025-11-08T20:14:23.790826
1137,“Anyone who thinks sitting in church can make you a Christian must also think that sitting in a garage can make you a car.”,Garrison Keillor,"humor, religion",2,2025-11-08T20:14:23.790928
1138,“Beauty is in the eye of the beholder and it may be necessary from time to time to give a stupid or misinformed beholder a black eye.”,Jim Henson,humor,1,2025-11-08T20:14:23.791022
1139,"“Today you are You, that is truer than true. There is no one alive who is Youer than You.”",Dr. Seuss,"comedy, life, yourself",3,2025-11-08T20:14:23.791118
1140,"“If you want your children to be intelligent, read them fairy tales. If you want them to be more intelligent, read them more fairy tales.”",Albert Einstein,"children, fairy-tales",2,2025-11-08T20:14:23.791210
1141,"“It is impossible to live without failing at something, unless you live so cautiously that you might as well not have lived at all - in which case, you fail by default.”",J.K. Rowling,,0,2025-11-08T20:14:23.791292
1142,“Logic will get you from A to Z; imagination will get you everywhere.”,Albert Einstein,imagination,1,2025-11-08T20:14:23.791379
1143,"“One good thing about music, when it hits you, you feel no pain.”",Bob Marley,music,1,2025-11-08T20:14:23.791463
1144,"“The more that you read, the more things you will know. The more that you learn, the more places you'll go.”",Dr. Seuss,"learning, reading, seuss",3,2025-11-08T20:14:25.077082
1145,"“Of course it is happening inside your head, Harry, but why on earth should that mean that it is not real?”",J.K. Rowling,dumbledore,1,2025-11-08T20:14:25.077193
1146,"“The truth is, everyone is going to hurt you. You just got to find the ones worth suffering for.”",Bob Marley,friendship,1,2025-11-08T20:14:25.077280
1147,“Not all of us can do great things. But we can do small things with great love.”,Mother Teresa,"misattributed-to-mother-teresa, paraphrased",2,2025-11-08T20:14:25.077373
1148,"“To the well-organized mind, death is but the next great adventure.”",J.K. Rowling,"death, inspirational",2,2025-11-08T20:14:25.077469
1149,“All you need is love. But a little chocolate now and then doesn't hurt.”,Charles M. Schulz,"chocolate, food, humor",3,2025-11-08T20:14:25.077567
1150,“We read to know we're not alone.”,William Nicholson,"misattributed-to-c-s-lewis, reading",2,2025-11-08T20:14:25.077659
1151,“Any fool can know. The point is to understand.”,Albert Einstein,"knowledge, learning, understanding, wisdom",4,2025-11-08T20:14:25.077762
1152,“I have always imagined that Paradise will be a kind of library.”,Jorge Luis Borges,"books, library",2,2025-11-08T20:14:25.077855
1153,“It is never too late to be what you might have been.”,George Eliot,inspirational,1,2025-11-08T20:14:25.077941
1154,"“A reader lives a thousand lives before he dies, said Jojen. The man who never reads lives only one.”",George R.R. Martin,"read, readers, reading, reading-books",4,2025-11-08T20:14:26.288754
1155,“You can never get a cup of tea large enough or a book long enough to suit me.”,C.S. Lewis,"books, inspirational, reading, tea",4,2025-11-08T20:14:26.288881
1156,“You believe lies so you eventually learn to trust no one but yourself.”,Marilyn Monroe,,0,2025-11-08T20:14:26.288961
1157,"“If you can make a woman laugh, you can make her do anything.”",Marilyn Monroe,"girls, love",2,2025-11-08T20:14:26.289053
1158,"“Life is like riding a bicycle. To keep your balance, you must keep moving.”",Albert Einstein,"life, simile",2,2025-11-08T20:14:26.289145
1159,“The real lover is the man who can thrill you by kissing your forehead or smiling into your eyes or just staring into space.”,Marilyn Monroe,love,1,2025-11-08T20:14:26.289231
1160,"“A wise girl kisses but doesn't love, listens but doesn't believe, and leaves before she is left.”",Marilyn Monroe,attributed-no-source,1,2025-11-08T20:14:26.289318
1161,“Only in the darkness can you see the stars.”,Martin Luther King Jr.,"hope, inspirational",2,2025-11-08T20:14:26.289406
1162,"“It matters not what someone is born, but what they grow to be.”",J.K. Rowling,dumbledore,1,2025-11-08T20:14:26.289491
1163,"“Love does not begin and end the way we seem to think it does. Love is a battle, love is a war; love is a growing up.”",James Baldwin,love,1,2025-11-08T20:14:26.289575
1164,"“There is nothing I would not do for those who are really my friends. I have no notion of loving people by halves, it is not my nature.”",Jane Austen,"friendship, love",2,2025-11-08T20:14:27.490546
1165,“Do one thing every day that scares you.”,Eleanor Roosevelt,"attributed, fear, inspiration",3,2025-11-08T20:14:27.490725
1166,"“I am good, but not an angel. I do sin, but I am not the devil. I am just a small girl in a big world trying to find someone to love.”",Marilyn Monroe,attributed-no-source,1,2025-11-08T20:14:27.490862
1167,"“If I were not a physicist, I would probably be a musician. I often think in music. I live my daydreams in music. I see my life in terms of music.”",Albert Einstein,music,1,2025-11-08T20:14:27.490995
1168,"“If you only read the books that everyone else is reading, you can only think what everyone else is thinking.”",Haruki Murakami,"books, thought",2,2025-11-08T20:14:27.491141
1169,“The difference between genius and stupidity is: genius has its limits.”,Alexandre Dumas fils,misattributed-to-einstein,1,2025-11-08T20:14:27.491254
1170,"“He's like a drug for you, Bella.”",Stephenie Meyer,"drug, romance, simile",3,2025-11-08T20:14:27.491348
1171,“There is no friend as loyal as a book.”,Ernest Hemingway,"books, friends, novelist-quotes",3,2025-11-08T20:14:27.491443
1172,"“When one door of happiness closes, another opens; but often we look so long at the closed door that we do not see the one which has been opened for us.”",Helen Keller,inspirational,1,2025-11-08T20:14:27.491535
1173,“Life isn't about finding yourself. Life is about creating yourself.”,George Bernard Shaw,"inspirational, life, yourself",3,2025-11-08T20:14:27.491632
1174,"“That's the problem with drinking, I thought, as I poured myself a drink. If something bad happens you drink in an attempt to forget; if something good happens you drink in order to celebrate; and if nothing happens you drink to make something happen.”",Charles Bukowski,alcohol,1,2025-11-08T20:14:28.675816
1175,“You don’t forget the face of the person who was your last hope.”,Suzanne Collins,the-hunger-games,1,2025-11-08T20:14:28.675930
1176,"“Remember, we're madly in love, so it's all right to kiss me anytime you feel like it.”",Suzanne Collins,humor,1,2025-11-08T20:14:28.676017
1177,"“To love at all is to be vulnerable. Love anything and your heart will be wrung and possibly broken. If you want to make sure of keeping it intact you must give it to no one, not even an animal. Wrap it carefully round with hobbies and little luxuries; avoid all entanglements. Lock it up safe in the casket or coffin of your selfishness. But in that casket, safe, dark, motionless, airless, it will change. It will not be broken; it will become unbreakable, impenetrable, irredeemable. To love is to be vulnerable.”",C.S. Lewis,love,1,2025-11-08T20:14:28.676109
1178,“Not all those who wander are lost.”,J.R.R. Tolkien,"bilbo, journey, lost, quest, travel, wander",6,2025-11-08T20:14:28.676224
1179,"“Do not pity the dead, Harry. Pity the living, and, above all those who live without love.”",J.K. Rowling,live-death-love,1,2025-11-08T20:14:28.676311
1180,“There is nothing to writing. All you do is sit down at a typewriter and bleed.”,Ernest Hemingway,"good, writing",2,2025-11-08T20:14:28.676401
1181,“Finish each day and be done with it. You have done what you could. Some blunders and absurdities no doubt crept in; forget them as soon as you can. Tomorrow is a new day. You shall begin it serenely and with too high a spirit to be encumbered with your old nonsense.”,Ralph Waldo Emerson,"life, regrets",2,2025-11-08T20:14:28.676494
1182,“I have never let my schooling interfere with my education.”,Mark Twain,education,1,2025-11-08T20:14:28.676583
1183,“I have heard there are troubles of more than one kind. Some come from ahead and some come from behind. But I've bought a big bat. I'm all ready you see. Now my troubles are going to have troubles with me!”,Dr. Seuss,troubles,1,2025-11-08T20:14:28.676669
1184,“If I had a flower for every time I thought of you...I could walk through my garden forever.”,Alfred Tennyson,"friendship, love",2,2025-11-08T20:14:29.868544
1185,“Some people never go crazy. What truly horrible lives they must lead.”,Charles Bukowski,humor,1,2025-11-08T20:14:29.868677
1186,"“The trouble with having an open mind, of course, is that people will insist on coming along and trying to put things in it.”",Terry Pratchett,"humor, open-mind, thinking",3,2025-11-08T20:14:29.868797
1187,"“Think left and think right and think low and think high. Oh, the thinks you can think up if only you try!”",Dr. Seuss,"humor, philosophy",2,2025-11-08T20:14:29.868911
1188,"“What really knocks me out is a book that, when you're all done reading it, you wish the author that wrote it was a terrific friend of yours and you could call him up on the phone whenever you felt like it. That doesn't happen much, though.”",J.D. Salinger,"authors, books, literature, reading, writing",5,2025-11-08T20:14:29.869049
1189,“The reason I talk to myself is because I’m the only one whose answers I accept.”,George Carlin,"humor, insanity, lies, lying, self-indulgence, truth",6,2025-11-08T20:14:29.869192
1190,"“You may say I'm a dreamer, but I'm not the only one. I hope someday you'll join us. And the world will live as one.”",John Lennon,"beatles, connection, dreamers, dreaming, dreams, hope, inspirational, peace",8,2025-11-08T20:14:29.869359
